COURSE_ID,TITLE,DESCRIPTION
ML0201EN,Robots Are Coming  Build Iot Apps With Watson  Swift  And Node Red,Have Fun With Iot And Learn Along The Way  If You Re A Swift Developer And Want To Learn More About Iot And Watson Ai Services In The Cloud  Raspberry Pi   And Node Red  You Ve Found The Right Place  You Ll Build Iot Apps To Read Temperature Data  Take Pictures With A Raspcam  Use Ai To Recognize The Objects In Those Pictures  And Program An Irobot Create 2 Robot
ML0122EN,Accelerating Deep Learning With Gpu,Training Complex Deep Learning Models With Large Datasets Takes Along Time  In This Course  You Will Learn How To Use Accelerated Gpu Hardware To Overcome The Scalability Problem In Deep Learning You Can Use Accelerated Hardware Such As Google S Tensor Processing Unit  Tpu  Or Nvidia Gpu To Accelerate Your Convolutional Neural Network Computations Time On The Cloud  These Chips Are Specifically Designed To Support The Training Of Neural Networks  As Well As The Use Of Trained Networks  Inference   Accelerated Hardware Has Recently Been Proven To Significantly Reduce Training Time But The Problem Is That Your Data Might Be Sensitiveand You May Not Feel Comfortable Uploading It On A Public Cloud  Preferring To Analyze It On Premise  In This Case  You Need To Use An In House System With Gpu Support  One Solution Is To Use Ibm S Power Systems With Nvidia Gpu And Power Ai  The Power Ai Platform Supports Popular Machine Learning Libraries And Dependencies Including Tensorflow  Caffe  Torch  And Theano In This Course  You Ll Understand What Gpu Based Accelerated Hardware Is And How It Can Benefit Your Deep Learning Scaling Needs  You Ll Also Deploy Deep Learning Networks On Gpu Accelerated Hardware For Several Problems  Including The Classification Of Images And Videos
GPXX0ZG0EN,Consuming Restful Services Using The Reactive Jax Rs Client,Learn How To Use A Reactive Jax Rs Client To Asynchronously Invoke Restful Microservices Over Http
RP0105EN,Analyzing Big Data In R Using Apache Spark,Apache Spark Is A Popular Cluster Computing Framework Used For Performing Large Scale Data Analysis  Sparkr Provides A Distributed Data Frame Api That Enables Structured Data Processing With A Syntax Familiar To R Users
GPXX0Z2PEN,Containerizing  Packaging  And Running A Spring Boot Application,Learn How To Containerize  Package  And Run A Spring Boot Application On An Open Liberty Server Without Modification
CNSC02EN,Cloud Native Security Conference   Data Security,Introduction To Data Security On Cloud
DX0106EN,Data Science Bootcamp With R For University Proffesors,A Multi Day Intensive  In Person Data Science Bootcamp Offered By Big Data University
GPXX0FTCEN,Learn How To Use Docker Containers For Iterative Development,Learn How To Use Docker Containers For Iterative Development
RAVSCTEST1,Scorm Test 1,Scron Test Course
GPXX06RFEN,Create Your First Mongodb Database,In This Guided Project  You Will Get Started With Mongodb By Creating Your First Database  Working With Collections  And Doing Basic Document Management
GPXX0SDXEN,Testing Microservices With The Arquillian Managed Container,Learn How To Develop Tests For Your Microservices With The Arquillian Managed Container And Run The Tests On Open Liberty
CC0271EN,Cloud Pak For Integration Essentials,In This Short Course  You Will Demonstrate The Hands On Experience With A Comprehensive Cloud Integration Solution Using Ibm Cloud Pak For Integration That You Received From Attending The Digital Developer Conference  Aiops   Integration
WA0103EN,Watson Analytics For Social Media,Watson Analytics For Social Media Fundamentals Teaches You The Basics Of Watson Analytics For Social Media On The Cloud   In This Course You Will Learn How To Setup A Project To Analyze Social Data Within Watson Analytics   You Will Learn How Smart Topic Suggestions Service Enables You To Refine And Improve Your Project   You Will Learn About How About The Base Line Reports With Watson Analytics For Social Media As Well As How You Can Further Use The Dataset In Watson Analytics Explore And Assemble
DX0108EN,Data Science Bootcamp With Python For University Professors  Advance ,Data Science Bootcamp With Python For University Professors  Advance
GPXX0PICEN,Create A Cryptocurrency Trading Algorithm In Python,Earning Money While You Sleep  That May Sound Too Good To Be True  But With The Right Cryptocurrency Trading Algorithm You Can Do Just That  In This Project  You Will Take A First Dive Into The World Of Algorithmic Trading With Python
DAI101EN,Data   Ai Essentials,Data And Ai Essentials Course
GPXX0W7KEN,Securing Java Microservices With Eclipse Microprofile Json Web Token  Microprofile Jwt ,You Will Explore How To Control User And Role Access To Microservices With Microprofile Json Web Token  Microprofile Jwt
GPXX0QR3EN,Enabling Distributed Tracing In Microservices With Zipkin,Explore How To Enable And Customize Tracing Of Jax Rs And Non Jax Rs Methods By Using Microprofile Opentracing And The Zipkin Tracing System
BD0145EN,Sql Access For Hadoop,Big Sql Is Another Tool To Work With Your Hadoop Data  Big Sql Provides A Common And Familiar Syntax For Those That Are Already Using Sql With Their Relational Data To Work With Their Big Data  There Is No Learning Curve Here  Big Sql Is About Applying Sql To Your Existing Data ‚Äì There Are No Proprietary Storage Formats This Course Will Help You Understand The Big Sql Architecture And Show The Different Methods For Working With Big Sql  The Course Will List And Explain The Big Sql Data Types And Show How To Create Big Sql Schemas And Table  The Course Will Also Cover The Different File Formats Supported By Big Sql Such As Parquet And Orc In The Lab Exercises  You Will Get A Chance To Learn How To Connect To The Big Sql Server And Load In Some Sample Data  Then You Will See How Easy It Is To Use Big Sql To Work With The Data
HCC105EN,Hybrid Cloud Conference  Ai Pipelines Lab,Hybrid Cloud Conference  Ai Pipelines Lab
DE0205EN,Dataops Methodology,Data Ops Course
DS0132EN,Data   Ai  Jumpstart Your Journey,Introduce You To Data And Ai
OS0101EN,Introduction To Open Source,This Course Introduces You To Open Source Software  You Ll Learn The Key Concepts  Tools  And Processes To Contribute To Any Open Source Project
DS0201EN,End To End Data Science On Cloudpak For Data,End To End Data Science On Cloudpak For Data
BENTEST4,Ai For Everyone  Master The Basics,Learn What Artificial Intelligence  Ai  Is By Understanding Its Applications And Key Concepts Including Machine Learning  Deep Learning And Neural Networks
CC0210EN,Serverless Computing Using Cloud Functions   Developer I,This Course Is Designed To Teach You Serverless Computing Essentials Which Include How To Develop Serverless Applications Composed Of Loosely Coupled  Microservice Like Functions
PA0103EN,Predicting Customer Satisfaction,Predict Customer Satisfactions With Machine Learning Moddels
HCC104EN,Hybrid Cloud Conference Serverless Lab,Hybrid Cloud Conference Serverless Lab
GPXX0A1YEN,Validating Constraints For Javabeans In Java Microservices,Explore The Use Of Bean Validation To Validate User Input Data For Microservices
TMP0105EN,Getting Started With The Data  Apache Spark Makers Build,Apache Spark Is An Open Source Processing Engine Built Around Speed  Ease Of Use  And Analytics  If You Have Large Amounts Of Data That Requires Low Latency Processing That A Typical Map Reduce Program Cannot Provide  Spark Is The Alternative  Spark Performs At Speeds Up To 100 Times Faster Than Map Reduce For Iterative Algorithms Or Interactive Data Mining  Spark Provides In Memory Cluster Computing For Lightning Fast Speed And Supports Java  Scala  And Python Apis For Ease Of Development Spark Combines Sql  Streaming And Complex Analytics Together Seamlessly In The Same Application To Handle A Wide Range Of Data Processing Scenarios  Spark Runs On Top Of Hadoop  Mesos  Standalone  Or In The Cloud  It Can Access Diverse Data Sources Such As Hdfs  Cassandra  Hbase  Or S3
PA0107EN,Predicting Financial Performance Of A Company,Predict Financial Performance Of A Company Using Machine Learning Models
DB0113EN,Db2 Fundamentals I,Db2 Database Course
PA0109EN,Using Clustering Methods For Investment Portfolio Analysis,Using Clustering Methods For Investment Portfolio Analysis
PHPM002EN,Php Web Application On A Lamp Stack,This Tutorial Walks You Through The Creation Of An Ubuntu Linux Virtual Server With Apache Web Server  Mysql Database And Php Scripting
GPXX03HFEN,Fundamentals Of Javascript Through Rock Paper Scissors,In This Hands On Project You Will Be Recreating The Game Of Rock  Paper  Scissors Using The Versatile And Popular Programming Language  Javascript
RP0103,Using R With Databases,The Intent Of This Course Is To Teach You How To Unlock The Power And Magic Of R To Analyze Data In Relational Databases  It Will Show You How To Connect To Relational Databases  Access And Query The Database  Update And Modify The Data  Analyze It And Perform Simple Visualizations
RP0103EN,Using R With Databases,Using R With Databases Teaches You How To Access And Perform Data Analysis Using R When Your Data Is Stored In A Relational Database Mangement System  Rdbms   In The Course We Will Focus On Using Rodbc As Our Interface And We Will Use Db2 Express C And Blu Acceleration For Cloud As Our Database Server Environment
BD0212EN,Spark Fundamentals Ii,Building On Your Foundational Knowledge Of Spark  Take This Opportunity To Move Your Skills To The Next Level  With A Focus On Spark Resilient Distributed Data Set Operations This Course Exposes You To Concepts That Are Critical To Your Success In This Field
GPXX0IBEN,Data Science In Insurance  Basic Statistical Analysis ,In This Guided Project You Will Learn How To Calculate Basic Descriptive Statistics Using Apache Spark
SECM03EN,Apply End To End Security To A Cloud Application,This Mini Course Walks You Through Key Security Services Available In The Ibm Cloud‚Ñ¢ Catalog And How To Use Them Together  An Application That Provides File Sharing Will Put Security Concepts Into Practice
SC0103EN,Spark Overview For Scala Analytics,The ‚  Spark Overview For Scala Analytics‚Äù Course Will Cover The History Of Spark And How It Came To Be  How To Build Applications With Spark  Establish An Understanding Of Rdds And Dataframes  And Other Advanced Spark Topics  Apache Spark‚Ñ¢ Is A Fast And General Engine For Large Scale Data Processing  With Built In Modules For Streaming  Sql  Machine Learning And Graph Processing  Having Finished This Class  A Student Would Be Prepared To Leverage The Core Rdd And Dataframe Apis To Perform Analytics On Datasets This Course Is Meant To Be An Overview Of Spark And Its Associated Ecosystem   For Deeper Understanding Of Spark  We Recommend That Students Take The Spark Fundamentals Courses I And Ii
GPXX0YXHEN,Testing A Microprofile Or Jakarta Ee Application Using Microshed Testing With An Open Liberty Docker Container,Learn How To Use Microshed Testing To Test A Microprofile Or Jakarta Ee Application
RP0151EN,R 101,In This Introduction To R  You Will Master The Basics Of This Beautiful Open Source Language  Including Factors  Lists And Data Frames  With The Knowledge Gained In This Course  You Will Be Ready To Undertake Your First Very Own Data Analysis  With Over 2 Million Users Worldwide R Is Rapidly Becoming The Leading Programming Language In Statistics And Data Science  Every Year  The Number Of R Users Grows By 40  And An Increasing Number Of Organizations Are Using It In Their Day To Day Activities  Leverage The Power Of R By Completing This Free R Online Course Today
TA0105,Text Analytics 101,Analyze Text Data Using Analytics And Machine Learning Models
SW0201EN,How To Build Watson Ai And Swift Apis And Make Money,Expose Your Cool Swift Microservices To The World And Build A Platform To Monetize Those Apis  By Using Server Side Swift And Your Mobile Apps  You Ll Also Learn To Be A Better Full Stack Developer
TMP0106,Data Science Bootcamp,A Multi Day Intensive  In Person Data Science Bootcamp Offered By Big Data University
GPXX0BUBEN,Insurance Risk Assessment With Montecarlo Method Using Apache Spark ,Learn About The Monte Carlo Method And Calculate The Ruin Probability Of An Insurance Company Using Apache Spark
ST0201EN,Statistics 201,Statistics Courses Teaching Basic Statistical Anlysis Methods
ST0301EN,Statistics 301,Statistics Courses Teaching Advanced Statistical Anlysis Methods
SW0101EN,Build Swift Mobile Apps With Watson Ai Services,Build Three Ai Ios Apps In The Cloud By Using Watson Services So That You Can Analyze The Emotion And Sentiment In Text  Recognize What S In A Photo  And Convert Text To Speech
TMP0101EN,Text Analysis,Analyze Text Data Using Various Analytics And Machine Learning Models
DW0101EN,Introduction To Machine Learning With Sound,Get Hands On Experience Creating And Training Machine Learning Models So That You Can Predict What Animal Is Making A Specific Sound  Like A Cat Purring Or A Dog Barking  Integrate Those Models In A Simple Web Page That You Build In Node Red  Then  Add Visual Recognition So That You Can Identify The Image Of An Animal
BD0143EN,Using Hbase For Real Time Access To Your Big Data,This Course Introduces You To Hbase  The Open Source Hadoop Database Used For Random  Real Time Read Writes To Your Big Data  The Course Will Cover Fundamental Concepts Of Hbase Such As Hbase System And Architecture  The Use Of The Client Api To Perform Data Operations On Hbase  The Various Hbase Client Used To Communicate With Hbase  How To Integrate Hbase With A Mapreduce Job  And More
WA0101EN,Watson Analytics 101,Welcome To Watson Analytics 101
GPXX04HEEN,Insurance Business Modelling And Basic Actuarial Calculations,In This Guided Project You Will Learn How To Build A Mathematical Model Of An Insurance Company Using Risk Process And To Do Risk And Revenue Assessment
BD0141EN,Accessing Hadoop Data Using Hive,Hive Is A Data Warehousing Tool Built On Top Of Hadoop  Learn How To Easily Query And Analyze Your Big Data Projects With This Free Apache Hive Course
CO0401EN,Beyond The Basics  Istio And Ibm Cloud Kubernetes Service,Start Managing Your Microservices With Istio On Ibm Cloud Kubernetes Service  This Course Shows You How To Better  Control Traffic To Services  Observe Service Health  And Secure The Service Mesh
ML0122ENv1,Accelerating Deep Learning With Gpu,Majority Of Data In The World Are Unlabeled And Unstructured Data  For Instance Images  Sound  And Text Data  Shallow Neural Networks Cannot Easily Capture Relevant Structure In These Kind Of Data  But Deep Networks Are Capable Of Discovering Hidden Structures Within¬†These Data  In This Course  You Will Use Tensorflow Library To Apply Deep Learning On Different Data Types To Solve Real World Problems
BD0151EN,Text Analytics 101,The Analysis Of Emails  Blogs  Tweets  Forums And Other Forms Of Unstructured Text Data Constitutes What We Call Text Analytics   Text Analytics Is Applicable To Most Industries  For Example  If Your Company Is Suspicious About Company Secrets Being Leaked To Competitors By Employees  Text Analytics Can Help Analyze Millions Of Employees   Emails   If You Would Like To Find Common Pain Points Your Customers Face When Using Your Products  You Can Analyze Their Comments And Questions In Forums  If You Would Like To Measure Positive Or Negative Perceptions Of A Company  Brand  Or Product  You Can Perform Sentiment Analysis Using Text Analytics  This Course Teaches You The Basics Of Text Analytics
TA0106EN,Text Analytics At Scale,A Continuation Of Text Analytics Getting Results With Systemt  This Course Shows How Early Information Extraction Systems Based On A Standard Formalism Of Cascading Grammars Suffer From Fundamental Limitations In Both Expressivity And Runtime Performance  The Class Explains In Detail How These Limitations Are Addressed Via The Declarative Principles In The Systemt Information Extraction System  Resulting In Extractors That Are Scalable  Accurate And Easy To Maintain And Enhance For A New Domain
TMP107,Data Science Bootcamp With Python,Data Science Bootcamp With Python
ML0111EN,Machine Learning With Apache Systemml,Apache Systemml Is A Declarative Style Language Designed For Large Scale Machine Learning  It Provides Automatic Generation Of Optimized Runtime Plans Ranging From Single Node  To In Memory  To Distributed Computations On Apache Hadoop And Apache Spark  Systemml Algorithms Are Expressed In R Like Or Python Like Syntax That Includes Linear Algebra Primitives  Statistical Functions And Ml Specific Constructs
GPXX048OEN,Action Classification Task Based On Internet Firewall Logs,Learn How To Build A Mathematical Model Of An Insurance Company Using Risk Process And To Do Risk And Revenue Assessment
CO0201EN,Container   Kubernetes Essentials With Ibm Cloud,Get Hands On Experience With Kubernetes Container Orchestration  Learn How Kubernetes And Ibm Cloud Kubernetes Service Help You More Easily Deploy And Scale Containers And Applications
GPXX01DCEN,Data Science In Health Care  Advanced Prognostication Using Neural Networks,Learn To Predict The Covid 19 Spread Dynamics In The World Using Neural Networks Of Different Structures
GPXX04XJEN,Advanced Machine   Deep Learning For Spam Classification Task,Learn To Build The Machine   Deep Learning Models At The Junction Of Nlp And Network Security Areas By The Help Of Sms Spam Collection Dataset With The Helping Frameworks   Libraries
GPXX0JZ4EN,Visual Data Analysis In Banking,Learn To Master The Visual Data Analysis In Banking For Machine Learning Models
GPXX0ZYVEN,Secure Analysis Of Credit Card Dataset,Learn To Make The Preliminary Data Analysis In Security Area Based On Credit Clients Card Dataset With The Helping Frameworks And Libraries
GPXX0ZMZEN,Data Science In Health Care  Advanced Machine Learning Classification,Learn To Apply An Advanced Analysis Of Big Data To The Spread Of Covid 19 In The World
GPXX0742EN,Network Traffic Anomaly Detection  Intrusion Detection Task ,Learn To Build The Model At The Junction Of Nlp And Network Security Areas With The Help Of Intrusion Detection Evaluation Dataset  Iscxids2012  And The Helping Frameworks   Libraries
GPXX0KV4EN,Getting Started With Node Js,Have You Heard Of Node Js Before  Node Js Is One Of The Most Popular Technology To Create Server Side Apps  Why  Because If You Know Javascript  You Build Both The Frontend And The Backend Using Javascript  Take This Guided Project To Get Started On Node Js
GPXX01RYEN,Getting Started With Mysql Command Line,In This Project  You Will Use The Mysql Command Line Interface  Cli  To Create A Database And To Restore The Structure And Contents Of Tables  Then You Will Learn How To Explore And Query Tables  Finally  You Will Learn How To Dump Backup Tables From Database
CC0120EN,An Introduction To Ibm Cloud Satellite,A Short Introduction To Ibm Cloud Satellite  Learn Why Clients Are So Excited To Implement The Features And Functionality Ibm Cloud Satellite Provides
QC0101EN,Introduction To Quantum Computing,This Course Introduces You To The Strange World Of Quantum Computing
GPXX0YMEEN,Launch An Ai Hotdog Detector As A Serverless Python App,Have You Ever Wondered If A Picture Has A Hotdog In It Or Not  Well  No Longer Do You Have To Wonder‚ You Can Now Prove It  With This Fun Project  You‚ Will Learn How To Create And Launch A Web App In Python That Tells You Just That  Whether Or Not A Picture Has A Hotdog In It  Let  S Settle The Great Debate Once And For All  Learning Skills That Can Help You Land Your Next Big Job Or Pursue Your Million Dollar Idea While You  Re At It
GPXX0Q8AEN,Exploratory Data Analysis  Eda  With Pandas In Banking,Learn To Master The Exploratory Data Analysis  Eda  In Banking With Pandas Framework
TA0105EN,Text Analytics 101,From Social Media To News Articles To Machine Logs  Text Data Is Everywhere  Are You Interested In Learning How To Derive Valuable Insights From Text Data  Enroll Today And Learn About The Hot Topic Of Text Analytics From Experts At Ibm
GPXX0XFQEN,Create Tables And Load Data In Mysql Using Phpmyadmin,In This Project  You Will Learn How To Create Tables And Load Data In The Mysql Database Service Using The Phpmyadmin Graphical User Interface  Gui  Tool
GPXX07REN,Relational Model Concepts,In This Project  You Will Learn The Concepts Of A Relational Model Including The Terms Entity  Attribute  Relation  Degree  And Cardinality  Then Apply The Concepts You Have Learned To A Real World Example Of A Database
PA0101EN,Predictive Modeling Fundamentals I,The Predictive Modelling Fundamentals I Course Where Students Can Take This Course Many Times As They Wish And Is Totally Free  After The Students Completed The Course  They Will Be To Print Their Online Certificate Of Achievement    Labs Are Available For Download Only For Free Trial Of Ibm Spss Modeler
BC0202EN,Build An Iot Blockchain Network For A Supply Chain,Learn How To Use A An Iot Asset Tracking Device  Build A Blockchain Network  And Configure A Node Red Dashboard To Monitor A Perishable Network Supply Chain  You Can Also Use A Simulated Tracker If You Don T Want To Purchase And Set Up The Hardware
BC0101EN,Blockchain Essentials,Understand Blockchain Technology And How It Can Solve Business Problems  Learn The Basics Of Developing Applications With Chaincode
GPXX0725EN,Getting Started With Postgresql Command Line,In This Project  You Will Use The Postgresql Command Line Interface  Cli  To A Create Database And To Restore The Structure And Contents Of Tables  Then You Will Learn How To Explore And Query Tables  Finally  You Will Learn How To Dump Backup Tables From A Database
BC0201EN,Ibm Blockchain Foundation Developer,Dive Deeper Into Blockchain Business Networks And Their Components  Ledgers  Consensus  Smart Contracts  And More  Learn How To Build Your First Blockchain Application And Get More Experience With Hyperledger Composer And Chaincode To Build Networks
GPXX0MIIEN,Keys And Constraints In Mysql,In This Project  You Will Learn How To Add Keys To Create Relationships Between The Tables And How To Use Constraints To Enforce Rules On The Data Entry In The Mysql Database Service Using The Phpmyadmin Graphical User Interface  Gui  Tool
BD0223EN,Exploring Spark S Graphx,Spark Provides A Graph Parallel Computation Library In Graphx  Graph Parallel Is A Paradigm That Allows Representation Of Your Data As Vertices And Edges  Spark S Graphx Provides A Set Of Fundamental Operators In Addition To A Growing Collection Of Algorithms And Builders To Simplify Graph Analytics Tasks
GPXX0435EN,Data Science In Health Care  Basic Statistical Analysis ,In This Guided Project You Will Learn How To Download  Pre Preparate And Make Statistical Analysis Of Elisa Tests And Collected Information About Igg And Igm  Vaccination Influenza  Vaccination Tuberculosis And Previous Diseases And Blood Groups
GPXX06ZLEN,Create Tables And Load Data In Postgresql Using Pgadmin,In This Project  You Will Learn How To Create Tables And Load Data In The Postgresql Database Service Using The Pgadmin Graphical User Interface  Gui  Tool
GPXX0QS6EN,Monitoring The Metrics Of Java Microservices Using Eclipse Microprofile Metrics,You Will Explore How To Provide System And Application Metrics From A Microservice With Microprofile Metrics
GPXX07YGEN,Configuring Microservices Running In Kubernetes,Explore How To Externalize Configuration Using Microprofile Config And Configure Your Microservices Using Kubernetes Configmaps And Secrets
AI0111EN,Game Playing Ai With Swift For Tensorflow  S4Tf ,In This Course  You Re Going To Learn How To Accelerate Machine Learning Model Development With Google S New Swift For Tensorflow Framework  By Building Ai Agents To Play Games Like Tic Tac Toe  Cartpole  And 2048
GPXX0QJFEN,Enabling Cross Origin Resource Sharing  Cors  In A Restful Java Microservice,Learn How To Enable Cross Origin Resource Sharing  Cors  In Open Liberty Without Writing Java Code
GPXX0LLEEN,Getting Started With Db2 On Cloud,In This Project  You Will Learn How To Create Tables And Load Data In Ibm Db2
BD0121EN,Apache Pig 101,Pig Was Initially Developed At Yahoo  To Allow People Using Hadoop To Focus More On Analyzing Large Data Sets And Spend Less Time Having To Write Mapper And Reducer Programs  Like Actual Pigs  Who Eat Almost Anything  The Pig Programming Language Is Designed To Handle Any Kind Of Data‚ Hence The Name
BD0135EN,Developing Distributed Applications Using Zookeeper,In This Course  You Will Explore The Zookeeper Framework In Tandem With Ibm Biginsights Modules And Java To Learn How To Develop And Manage Distributed Applications In The Domain Of Big Data  Real World Examples Will Be Used To Contextualize And Motivate Further Study
BD0133EN,Controlling Hadoop Jobs Using Oozie,This Apache Oozie Course Teaches You How To Control Hadoop Jobs On Your Big Data Projects  Even Better  The Materials And Software Provided Are All Free
BD0131EN,Moving Data Into Hadoop,This Course Describes Techniques For Moving Data Into Hadoop  There Are A Variety Of Ways To Get Data Into Hadoop From Simple Hadoop Shell Commands To More Sophisticated Processes  Several Techniques Are Presented But Three  Sqoop  Flume  And Data Click Are Covered In Greater Detail
BD0115EN,Mapreduce And Yarn,String Together Your Understanding Of Yet Another Resource Negotiator  Yarn  By Gaining Exposure To Mapreduce1  The Tool Sets That Start The Processing Of Big Data
GPXX04V3EN,Deploy A Web Server Using Python And Ibm Cloud Engine,Deploy A Web Server Using Python And Ibm Cloud Engine
GPXX05P1EN,Acknowledging Messages Using Microprofile Reactive Messaging,Learn How To Acknowledge Messages By Using Microprofile Reactive Messaging
GPXX0D14EN,Build A Personal Movie Recommender With Django,Choosing A Good Movie To Watch On A Weekend Evening Is Always Hard   It Would Be Great If There Is A Handy Movie Recommender To Help You Make A Good Decision
