COURSE_ID,TITLE,DESCRIPTION
GPXX0KY1EN,Data Science In Health Care  Basic Prognostication And Geo Visualization,In This Guided Project We Will Study How Make Predictions Based On Linear Regression  Obtain Statistics And Create Interactive Maps Showing The Dynamics Of Virus Spread
GPXX0JLHEN,Enabling Distributed Tracing In Java Microservices Using Eclipse Microprofile Opentracing And The Jaeger Tracing System ,Explore How To Enable And Customize Tracing Of Jax Rs And Non Jax Rs Methods By Using Microprofile Opentracing And Jaeger
CC0150EN,Building Cloud Native And Multicloud Applications,In This Course  We Will Cover The Core Concepts And Practices Of Building And Running Cloud Native Applications And How To Run These Applications In A Multicloud Environment  We Will Cover Technologies And Practices Including  Microservices  Devops  Ci Cd  Docker  Kubernetes  And Openshift
GPXX0QQ3EN,Deploy An Ai Powered Discord Bot With A Voice,Discord Is A Fantastic Way To Connect With Your Friends Or Host A Community And A Bot Is A Perfect Way To Add Features To Your Server  Not Only Will This Guided Project Show You How To Get Started In Creating A Bot  But You Ll Also Learn How To Power It With An Ai Chatbot And Give It A Voice  Finally  You Ll Host It Somewhere So That The Bot Is Online Without Your Computer Being On  All Of This For Free
GPXX0RQLEN,Views In Postgresql,In This Project  You Will Learn How To Create And Execute Views And Materialized Views In The Postgresql Database Service Using The Pgadmin Graphical User Interface  Gui  Tool  Materialized Views Behave Differently Compared To Regular Views  In Materialized Views  Result Set Is Materialized Or Saved For Future Use  You Can T Insert  Update  Or Delete Rows Like In Regular Views  Materialized Views Can Improve Performance
GPXX0WRDEN,Streaming Updates From A Microprofile Reactive Messaging Microservice Using Server Sent Events  Sse ,Learn How To Stream Updates From A Microprofile Reactive Messaging Service To A Front End Client By Using Server Sent Events  Sse
GPXX0ADEN,Consuming A Restful Java Web Service With Angular,Explore How To Access A Simple Restful Web Service And Consume Its Resources With Angular In Open Liberty
ML0120ENv3,Deep Learning With Tensorflow,Majority Of Data In The World Are Unlabeled And Unstructured Data  For Instance Images  Sound  And Text Data  Shallow Neural Networks Cannot Easily Capture Relevant Structure In These Kind Of Data  But Deep Networks Are Capable Of Discovering Hidden Structures Within¬†These Data  In This Course  You Will Use Tensorflow Library To Apply Deep Learning On Different Data Types To Solve Real World Problems
SC0105EN,Data Science With Scala,Apache Spark Is A Fast And General Engine For Large Scale Data Processing  With Built In Modules For Streaming  Sql  Machine Learning And Graph Processing  This Course Shows How To Use Spark  S Machine Learning Pipelines To Fit Models And Search For Optimal Hyperparameters Using A Spark Cluster
excourse01,Relational Database Systems,Welcome To The Specialization Course Relational Database Systems  This Course Will Be Completed On Six Weeks  It Will Be Supported With Videos And Various Documents That Will Allow You To Learn In A Very Simple Way How Several Types Of Information Systems And Databases Are Available To Solve Different Problems And Needs Of The Companies  Objective  A Learner Will Be Able To Design  Test  And Implement Analytical  Transactional Or Nosql Database Systems According To Business Requirements By Programming Reliable  Scalable And Maintainable Applications And Resources Using Sql And Hadoop Ecosystem  Programming Languages  For Course 1 You Will Use The Mysql Language  Software To Download  Mysql Workbench In Case You Have A Mac   Ios Operating System You Will Need To Use A Virtual Machine  Virtualbox  Vmware
excourse02,Business Intelligence And Data Warehousing,Welcome To The Specialization Course Business Intelligence And Data Warehousing  This Course Will Be Completed On Six Weeks  It Will Be Supported With Videos And Various Documents That Will Allow You To Learn In A Very Simple Way How To Identify  Design And Develop Analytical Information Systems  Such As Business Intelligence With A Descriptive Analysis On Data Warehouses  You Will Be Able To Understand The Problem Of Integration And Predictive Analysis Of High Volume Of Unstructured Data  Big Data  With Data Mining And The Hadoop Framework
excourse03,Nosql Systems,Welcome To The Specialization Course Of Nosql Systems  This Course Will Be Completed On Six Weeks  It Will Be Supported With Videos And Exercises That Will Allow You To Identify The Differences Between The Relational And Nosql Databases  As Part Of These Alternative Technologies The Student Will Learn The Main Characteristics And How To Implement The Typical Nosql Databases  Such As Key Value  Columnar  Document And Graph  Let S Start After Completing This Course  A Learner Will Be Able Toidentify What Type Of Nosql Database To Implement Based On Business Requirements  Key Value  Document  Full Text  Graph  Etc  Apply Nosql Data Modeling From Application Specific Queriesuse Atomic Aggregates And Denormalization As Data Modelling Techniques To Optimize Query Processingsoftware To Download Mongodbneo4Jsapiqcassandra
excourse04,"
Sql For Data Science",As Data Collection Has Increased Exponentially  So Has The Need For People Skilled At Using And Interacting With Data  To Be Able To Think Critically  And Provide Insights To Make Better Decisions And Optimize Their Businesses  This Is A Data Scientist    Part Mathematician  Part Computer Scientist  And Part Trend Spotter    Sas Institute  Inc    According To Glassdoor  Being A Data Scientist Is The Best Job In America  With A Median Base Salary Of  110 000 And Thousands Of Job Openings At A Time  The Skills Necessary To Be A Good Data Scientist Include Being Able To Retrieve And Work With Data  And To Do That You Need To Be Well Versed In Sql  The Standard Language For Communicating With Database Systems This Course Is Designed To Give You A Primer In The Fundamentals Of Sql And Working With Data So That You Can Begin Analyzing It For Data Science Purposes  You Will Begin To Ask The Right Questions And Come Up With Good Answers To Deliver Valuable Insights For Your Organization  This Course Starts With The Basics And Assumes You Do Not Have Any Knowledge Or Skills In Sql  It Will Build On That Foundation And Gradually Have You Write Both Simple And Complex Queries To Help You Select Data From Tables   You Ll Start To Work With Different Types Of Data Like Strings And Numbers And Discuss Methods To Filter And Pare Down Your Results  You Will Create New Tables And Be Able To Move Data Into Them  You Will Learn Common Operators And How To Combine The Data  You Will Use Case Statements And Concepts Like Data Governance And Profiling  You Will Discuss Topics On Data  And Practice Using Real World Programming Assignments  You Will Interpret The Structure  Meaning  And Relationships In Source Data And Use Sql As A Professional To Shape Your Data For Targeted Analysis Purposes  Although We Do Not Have Any Specific Prerequisites Or Software Requirements To Take This Course  A Simple Text Editor Is Recommended For The Final Project  So What Are You Waiting For  This Is Your First Step In Landing A Job In The Best Occupation In The Us And Soon The World
excourse05,"
Distributed Computing With Spark Sql",This Course Is All About Big Data  It  S For Students With Sql Experience That Want To Take The Next Step On Their Data Journey By Learning Distributed Computing Using Apache Spark  Students Will Gain A Thorough Understanding Of This Open Source Standard For Working With Large Datasets  Students Will Gain An Understanding Of The Fundamentals Of Data Analysis Using Sql On Spark  Setting The Foundation For How To Combine Data With Advanced Analytics At Scale And In Production Environments  The Four Modules Build On One Another And By The End Of The Course You Will Understand  The Spark Architecture  Queries Within Spark  Common Ways To Optimize Spark Sql  And How To Build Reliable Data Pipelines  The First Module Introduces Spark And The Databricks Environment Including How Spark Distributes Computation And Spark Sql  Module 2 Covers The Core Concepts Of Spark Such As Storage Vs  Compute  Caching  Partitions  And Troubleshooting Performance Issues Via The Spark Ui  It Also Covers New Features In Apache Spark 3 X Such As Adaptive Query Execution  The Third Module Focuses On Engineering Data Pipelines Including Connecting To Databases  Schemas And Data Types  File Formats  And Writing Reliable Data  The Final Module Covers Data Lakes  Data Warehouses  And Lakehouses  Students Build Production Grade Data Pipelines By Combining Spark With The Open Source Project Delta Lake  By The End Of This Course  Students Will Hone Their Sql And Distributed Computing Skills To Become More Adept At Advanced Analysis And To Set The Stage For Transitioning To More Advanced Analytics As Data Scientists
excourse06,"
Sql For Data Science Capstone Project",Data Science Is A Dynamic And Growing Career Field That Demands Knowledge And Skills Based In Sql To Be Successful  This Course Is Designed To Provide You With A Solid Foundation In Applying Sql Skills To Analyze Data And Solve Real Business Problems Whether You Have Successfully Completed The Other Courses In The Learn Sql Basics For Data Science Specialization Or Are Taking Just This Course  This Project Is Your Chance To Apply The Knowledge And Skills You Have Acquired To Practice Important Sql  Querying And Solve Problems With Data  You Will Participate In Your Own Personal Or Professional Journey To Create A Portfolio Worthy Piece From Start To Finish  You Will Choose A Dataset And Develop A Project Proposal  You Will Explore Your Data And Perform Some Initial Statistics You Have Learned Through This Specialization  You Will Uncover Analytics For Qualitative Data And Consider New Metrics That Make Sense From The Patterns That Surface In Your Analysis  You Will Put All Of Your Work Together In The Form Of A Presentation Where You Will Tell The Story Of Your Findings  Along The Way  You Will Receive Feedback Through The Peer Review Process  This Community Of Fellow Learners Will Provide Additional Input To Help You Refine Your Approach To Data Analysis With Sql And Present Your Findings To Clients And Management
excourse07,Database Management Essentials,Database Management Essentials Provides The Foundation You Need For A Career In Database Development  Data Warehousing  Or Business Intelligence  As Well As For The Entire Data Warehousing For Business Intelligence Specialization  In This Course  You Will Create Relational Databases  Write Sql Statements To Extract Information To Satisfy Business Reporting Requests  Create Entity Relationship Diagrams  Erds  To Design Databases  And Analyze Table Designs For Excessive Redundancy  As You Develop These Skills  You Will Use Either Oracle  Mysql  Or Postgresql To Execute Sql Statements And A Database Diagramming Tool Such As The Er Assistant Or Visual Paradigm To Create Erds  We  Ve Designed This Course To Ensure A Common Foundation For Specialization Learners  Everyone Taking The Course Can Jump Right In With Writing Sql Statements In Oracle  Mysql  Or Postgresql
excourse08,Using Databases With Python,This Course Will Introduce Students To The Basics Of The Structured Query Language  Sql  As Well As Basic Database Design For Storing Data As Part Of A Multi Step Data Gathering  Analysis  And Processing Effort   The Course Will Use Sqlite3 As Its Database   We Will Also Build Web Crawlers And Multi Step Data Gathering And Visualization Processes   We Will Use The D3 Js Library To Do Basic Data Visualization   This Course Will Cover Chapters 14 15 Of The Book   Python For Everybody    To Succeed In This Course  You Should Be Familiar With The Material Covered In Chapters 1 13 Of The Textbook And The First Three Courses In This Specialization  This Course Covers Python 3
excourse09,Process Data From Dirty To Clean,In This Course  You  Ll Continue To Build Your Understanding Of Data Analytics And The Concepts And Tools That Data Analysts Use In Their Work  You  Ll Learn How To Check And Clean Your Data Using Spreadsheets And Sql As Well As How To Verify And Report Your Data Cleaning Results  Current Google Data Analysts Will Continue To Instruct And Provide You With Hands On Ways To Accomplish Common Data Analyst Tasks With The Best Tools And Resources Learners Who Complete This Certificate Program Will Be Equipped To Apply For Introductory Level Jobs As Data Analysts  No Previous Experience Is Necessary By The End Of This Course  You Will Be Able To Do The Following    Learn How To Check For Data Integrity    Discover Data Cleaning Techniques Using Spreadsheets     Develop Basic Sql Queries For Use On Databases    Apply Basic Sql Functions For Cleaning And Transforming Data    Gain An Understanding Of How To Verify The Results Of Cleaning Data    Explore The Elements And Importance Of Data Cleaning Reports
excourse10,Database Architecture  Scale  And Nosql With Elasticsearch,You Will Explore Database Architecture  Postgresql  And Various Scalable Deployment Configurations  You Will See How Postgresql Implements Basic Crud Operations And Indexes  And Review How Transactions And The Acid  Atomicity  Consistency  Isolation  Durability  Requirements Are Implemented  You  Ll Learn To Use Elasticsearch Nosql  Which Is A Common Nosql Database And A Supplement To A Relational Database To High Speed Search And Indexing  We Will Examine Elasticsearch As An Example Of A Base Style  Basic Availability  Soft State  Eventual Consistency  Database Approach  As Well As Compare And Contrast The Advantages And Challenges Associated With Acid And Base Databases
excourse11,The Nature Of Data And Relational Database Design,This Course Provides A Comprehensive Overview Of Data  Various Data Types  Design Of Databases For Storage Of Data  And Creation And Manipulation Of Data In Databases Using Sql  By The End Of This Course  Students Will Be Able To Describe What Business Intelligence Is And How It  S Different From Business Analytics And Data Science  Conduct A Basic Descriptive Statistical Analysis And Articulate The Findings  And Differentiate Between Types Of Statistics  They Will Also Be Able To Define Normalization And Etl  Create An Erd That Shows Progression From Conceptual To Logical To Physical Design  Define Ddl  Dml  Dcl  And Tcl  And Write Sql Scripts To Create A Database And Associated Tables
excourse12,Python Scripting  Files  Inheritance  And Databases,This Course Is The Third Course In A Series That Aims To Prepare You For A Role Working As A Programmer  In This Course  You Will Be Introduced To The Three Main Concepts In Programming  Files  Inheritance And External Libaries   Labs Will Allow The Students To Apply The Material In The Lectures In Simple Computer Programs Designed To Re Enforce The Material In The Lesson
excourse13,Relational Database Support For Data Warehouses,Relational Database Support For Data Warehouses Is The Third Course In The Data Warehousing For Business Intelligence Specialization  In This Course  You Ll Use Analytical Elements Of Sql For Answering Business Intelligence Questions  You Ll Learn Features Of Relational Database Management Systems For Managing Summary Data Commonly Used In Business Intelligence Reporting  Because Of The Importance And Difficulty Of Managing Implementations Of Data Warehouses  We Ll Also Delve Into Storage Architectures  Scalable Parallel Processing  Data Governance  And Big Data Impacts  In The Assignments In This Course  You Can Use Either Oracle Or Postgresql
excourse14,Introduction To Structured Query Language  Sql ,In This Course  You Ll Walk Through Installation Steps For Installing A Text Editor  Installing Mamp Or Xampp  Or Equivalent  And Creating A Mysql Database  You Ll Learn About Single Table Queries And The Basic Syntax Of The Sql Language  As Well As Database Design With Multiple Tables  Foreign Keys  And The Join Operation  Lastly  You Ll Learn To Model Many To Many Relationships Like Those Needed To Represent Users  Roles  And Courses
excourse15,Crash Course On Python,This Course Is Designed To Teach You The Foundations In Order To Write Simple Programs In Python Using The Most Common Structures  No Previous Exposure To Programming Is Needed  By The End Of This Course  You Ll Understand The Benefits Of Programming In It Roles  Be Able To Write Simple Programs Using Python  Figure Out How The Building Blocks Of Programming Fit Together  And Combine All Of This Knowledge To Solve A Complex Programming Problem  We Ll Start Off By Diving Into The Basics Of Writing A Computer Program  Along The Way  You  Ll Get Hands On Experience With Programming Concepts Through Interactive Exercises And Real World Examples  You  Ll Quickly Start To See How Computers Can Perform A Multitude Of Tasks    You Just Have To Write Code That Tells Them What To Do
excourse16,Programming For Everybody  Getting Started With Python ,This Course Aims To Teach Everyone The Basics Of Programming Computers Using Python  We Cover The Basics Of How One Constructs A Program From A Series Of Simple Instructions In Python   The Course Has No Pre Requisites And Avoids All But The Simplest Mathematics  Anyone With Moderate Computer Experience Should Be Able To Master The Materials In This Course  This Course Will Cover Chapters 1 5 Of The Textbook   Python For Everybody     Once A Student Completes This Course  They Will Be Ready To Take More Advanced Programming Courses  This Course Covers Python 3
excourse17,Python Basics,This Course Introduces The Basics Of Python 3  Including Conditional Execution And Iteration As Control Structures  And Strings And Lists As Data Structures  You Ll Program An On Screen Turtle To Draw Pretty Pictures  You Ll Also Learn To Draw Reference Diagrams As A Way To Reason About Program Executions  Which Will Help To Build Up Your Debugging Skills  The Course Has No Prerequisites  It Will Cover Chapters 1 9 Of The Textbook   Fundamentals Of Python Programming    Which Is The Accompanying Text  Optional And Free  For This Course The Course Is For You If You Re A Newcomer To Python Programming  If You Need A Refresher On Python Basics  Or If You May Have Had Some Exposure To Python Programming But Want A More In Depth Exposition And Vocabulary For Describing And Reasoning About Programs
excourse18,Python Programming  A Concise Introduction,The Goal Of The Course Is To Introduce Students To Python Version 3 X Programming Using Hands On Instruction  It Will Show How To Install Python And Use The Spyder Ide  Integrated Development Environment  For Writing And Debugging Programs  The Approach Will Be To Present An Example Followed By A Small Exercise Where The Learner Tries Something Similar To Solidify A Concept   At The End Of Each Module There Will Be An Exercise Where The Student Is Required To Write Simple Programs And Submit Them For Grading   It Is Intended For Students With Little Or No Programming Background  Although Students With Such A Background Should Be Able To Move Forward At Their Preferred Pace The Course Is Four Modules Long And Is Designed To Be Completed In Four Weeks
excourse19,Introduction To Python Programming,This Course Provides An Introduction To Programming And The Python Language   Students Are Introduced To Core Programming Concepts Like Data Structures  Conditionals  Loops  Variables  And Functions   This Course Includes An Overview Of The Various Tools Available For Writing And Running Python  And Gets Students Coding Quickly   It Also Provides Hands On Coding Exercises Using Commonly Used Data Structures  Writing Custom Functions  And Reading And Writing To Files  This Course May Be More Robust Than Some Other Introductory Python Courses  As It Delves Deeper Into Certain Essential Programming Topics
excourse20,Python And Statistics For Financial Analysis,Python Is Now Becoming The Number 1 Programming Language For Data Science  Due To Python  S Simplicity And High Readability  It Is Gaining Its Importance In The Financial Industry   The Course Combines Both Python Coding And Statistical Concepts And Applies Into Analyzing Financial Data  Such As Stock Data By The End Of The Course  You Can Achieve The Following Using Python   Import  Pre Process  Save And Visualize Financial Data Into Pandas Dataframe  Manipulate The Existing Financial Data By Generating New Variables Using Multiple Columns  Recall And Apply The Important Statistical Concepts  Random Variable  Frequency  Distribution  Population And Sample  Confidence Interval  Linear Regression  Etc    Into Financial Contexts  Build A Trading Model Using Multiple Linear Regression Model   Evaluate The Performance Of The Trading Model Using Different Investment Indicatorsjupyter Notebook Environment Is Configured In The Course Platform For Practicing Python Coding Without Installing Any Client Applications
excourse21,Applied Machine Learning In Python,This Course Will Introduce The Learner To Applied Machine Learning  Focusing More On The Techniques And Methods Than On The Statistics Behind These Methods  The Course Will Start With A Discussion Of How Machine Learning Is Different Than Descriptive Statistics  And Introduce The Scikit Learn Toolkit Through A Tutorial  The Issue Of Dimensionality Of Data Will Be Discussed  And The Task Of Clustering Data  As Well As Evaluating Those Clusters  Will Be Tackled  Supervised Approaches For Creating Predictive Models Will Be Described  And Learners Will Be Able To Apply The Scikit Learn Predictive Modelling Methods While Understanding Process Issues Related To Data Generalizability  E G  Cross Validation  Overfitting   The Course Will End With A Look At More Advanced Techniques  Such As Building Ensembles  And Practical Limitations Of Predictive Models  By The End Of This Course  Students Will Be Able To Identify The Difference Between A Supervised  Classification  And Unsupervised  Clustering  Technique  Identify Which Technique They Need To Apply For A Particular Dataset And Need  Engineer Features To Meet That Need  And Write Python Code To Carry Out An Analysis  This Course Should Be Taken After Introduction To Data Science In Python And Applied Plotting  Charting   Data Representation In Python And Before Applied Text Mining In Python And Applied Social Analysis In Python
excourse22,Introduction To Data Science In Python,This Course Will Introduce The Learner To The Basics Of The Python Programming Environment  Including Fundamental Python Programming Techniques Such As Lambdas  Reading And Manipulating Csv Files  And The Numpy Library  The Course Will Introduce Data Manipulation And Cleaning Techniques Using The Popular Python Pandas Data Science Library And Introduce The Abstraction Of The Series And Dataframe As The Central Data Structures For Data Analysis  Along With Tutorials On How To Use Functions Such As Groupby  Merge  And Pivot Tables Effectively  By The End Of This Course  Students Will Be Able To Take Tabular Data  Clean It  Manipulate It  And Run Basic Inferential Statistical Analyses  This Course Should Be Taken Before Any Of The Other Applied Data Science With Python Courses  Applied Plotting  Charting   Data Representation In Python  Applied Machine Learning In Python  Applied Text Mining In Python  Applied Social Network Analysis In Python
excourse23,Data Analysis Using Python,This Course Provides An Introduction To Basic Data Science Techniques Using Python   Students Are Introduced To Core Concepts Like Data Frames And Joining Data  And Learn How To Use Data Analysis Libraries Like Pandas  Numpy  And Matplotlib   This Course Provides An Overview Of Loading  Inspecting  And Querying Real World Data  And How To Answer Basic Questions About That Data   Students Will Gain Skills In Data Aggregation And Summarization  As Well As Basic Data Visualization
